{
  "schema_version": "arbitrium.result.v1",
  "request_id": "example-recovery-001",
  "task_id": "runtime.recovery.v1",
  "artifact_id": "illustrative-only",
  "kind": "choice",
  "status": "ok",
  "verdict": "retry",
  "probabilities": [
    {
      "label": "retry",
      "probability": 0.92
    },
    {
      "label": "fallback",
      "probability": 0.06
    },
    {
      "label": "stop",
      "probability": 0.02
    }
  ],
  "score": null,
  "confidence": 0.92,
  "answerability": 0.96,
  "reason_code": null,
  "calibration_id": "illustrative-only",
  "error": null
}
